{
  "runSettings": {
    "temperature": 1.0,
    "model": "models/gemini-3-pro-preview",
    "topP": 0.95,
    "topK": 64,
    "maxOutputTokens": 65536
  },
  "systemInstruction": {},
  "chunkedPrompt": {
    "chunks": [
      {
        "role": "user",
        "text": "in diceter asyclic graphical models , \nwhe calculate the \nP(C) = Mutiply (P(indepentent event) * Pl(even1| eventes direter to it ) ...\nlike if we have \nA and p indepenet so p(A) , p(B) idependent )\nwhile c depent to A and B , so we write P(c | a,b) \nd dpeent to c b , P(D|C,B) \nE depend to C D , so we write P(E| D ,C) ,\nright ?\n",
        "tokenCount": 141
      },
      {
        "role": "model",
        "text": "**Verifying the Factorization**\n\nI'm now comparing the user's factorization against my own derived structure from the DAG. I've verified the conditional probabilities for each node: C depends on A and B, D depends on B and C, and E depends on C and D.",
        "tokenCount": 1475,
        "isThought": true,
        "parts": [
          {
            "text": "**Verifying the Factorization**\n\nI'm now comparing the user's factorization against my own derived structure from the DAG.",
            "thought": true
          }
        ]
      },
      {
        "role": "model",
        "text": "Yes, you are **absolutely correct!** You have analyzed the dependencies in the graph perfectly.\n\nIn a **Directed Acyclic Graphical Model (Bayesian Network)**, the rule for calculating the **Joint Probability Distribution** (the probability of all events happening together) is:\n\n$$P(\\text{All Nodes}) = \\prod P(\\text{Node} \\mid \\text{Parents of Node})$$\n\nHere is the breakdown based on your image, confirming exactly what you wrote:\n\n1.  **Nodes A and B:** They have no incoming arrows (no parents). They are independent roots.\n    *   You write: $P(A)$ and $P(B)$.\n    *   **Correct.**\n\n2.  **Node C:** It has arrows coming from **A** and **B**.\n    *   You write: $P(C \\mid A, B)$.\n    *   **Correct.**\n\n3.  **Node D:** It has arrows coming from **B** and **C**.\n    *   You write: $P(D \\mid C, B)$.\n    *   **Correct.**\n\n4.  **Node E:** It has arrows coming from **C** and **D**.\n    *   You write: $P(E \\mid D, C)$.\n    *   **Correct.**",
        "tokenCount": 403
      }
    ]
  },
  "pendingInputs": [
    {
      "text": "",
      "role": "user"
    }
  ]
}
